{
  "schemaVersion": "1.0.0",
  "projectionId": "dashboard-projection-stale-fixture-001",
  "generatedAt": "2026-06-06T09:10:00Z",
  "generatedBy": "services/dashboard-adapter",
  "authority": {
    "runtimeTruthOwner": "runtime",
    "projectionProducer": "services/dashboard-adapter",
    "dashboardRole": "passive-visual-consumer",
    "projectionIsAuthoritative": false
  },
  "sourceEvidence": [
    {
      "sourceId": "validate-projection-contracts",
      "sourceKind": "validation-report",
      "sourcePath": "runtime/execution/validation-reports/validate-projection-contracts.json",
      "sourceStatus": "pass",
      "observedAt": "2026-06-06T09:12:30Z"
    },
    {
      "sourceId": "projection-contract-governance",
      "sourceKind": "governance-document",
      "sourcePath": "docs/governance/PROJECTION_CONTRACT.md",
      "sourceStatus": "pass",
      "observedAt": "2026-06-06T09:08:00Z"
    }
  ],
  "validationSummary": {
    "overallStatus": "warning",
    "validatorResults": [
      {
        "validatorId": "validate-projection-contracts",
        "status": "pass",
        "reportPath": "runtime/execution/validation-reports/validate-projection-contracts.json"
      }
    ]
  },
  "boundarySummary": {
    "writesAllowed": false,
    "runtimeMutationAllowed": false,
    "projectionMutationAllowed": false,
    "executionEnabled": false,
    "providerCallsAllowed": false,
    "deploymentAllowed": false,
    "secretAccessAllowed": false,
    "dashboardMutationAllowed": false
  },
  "staleness": {
    "state": "stale",
    "lastSourceObservedAt": "2026-06-06T09:12:30Z",
    "staleReason": "Source evidence was observed after projection generation."
  },
  "display": {
    "title": "Stale projection fixture",
    "labels": [
      "not executable",
      "readiness evidence only",
      "provider calls disabled",
      "deployment disabled",
      "secret access disabled",
      "runtime is source of truth",
      "adapter produced projection",
      "dashboard read only"
    ],
    "sections": [
      {
        "sectionId": "projection-staleness",
        "heading": "Projection staleness",
        "sourceIds": [
          "validate-projection-contracts",
          "projection-contract-governance"
        ]
      }
    ]
  }
}
